Sr.No,Complain No,Customer Name,Customer Address,Machine Name,Machine Serail No,Engineer Name,Engineer Remark,column 1,column blNK1,column 1,column 1,column 1,column 1,column 1,column 1,column 1,column 1
1,CMP0001,Melissa Shelton,"250 Lambert Estate Suite 155, Tiffanymouth, WA 96797",Enter Machine,MSN00001,Ivan Cole,Phone than at successful.,1,,1,1,1,1,1,1,1,1
2,CMP0002,Jared Blackburn,"41600 Medina Plains, Port Perry, MD 71504",Debate Machine,MSN00002,Lindsay Nelson,Threat big her find.,1,,1,1,1,1,1,1,1,1
3,CMP0003,Jonathan Burgess,"087 Nicholas Plaza Suite 641, Karenton, ID 70489",Discussion Machine,MSN00003,Clayton Wagner,Stuff board form crime least experience red.,1,,1,1,1,1,1,1,1,1
4,CMP0004,Ryan White,"5523 Donald Knolls Apt. 248, Rodriguezhaven, CT 63197",Seem Machine,MSN00004,Greg Bailey,East full protect mother.,1,,1,1,1,1,1,1,1,1
5,CMP0005,Miss Deborah Brown,"8550 Branch Mount Suite 194, Bryanfort, MP 05829",Policy Machine,MSN00005,Pamela Brewer,Church when spring quality purpose.,1,,1,1,1,1,1,1,1,1
6,CMP0006,Janet Adams,"36981 Mclaughlin Hollow Apt. 674, Lake Theresa, DE 79300",Also Machine,MSN00006,Brandon Edwards,Option position someone own nature season.,1,,1,1,1,1,1,1,1,1
7,CMP0007,Dr. Manuel Bryant,"17692 Everett Shoals Apt. 943, Bonillaborough, AZ 46850",Institution Machine,MSN00007,Anthony Vega,Glass exist word whom affect we.,1,,1,1,1,1,1,1,1,1
8,CMP0008,Terry Young,"5816 Robertson Causeway Suite 945, Lake Jasonton, FM 50775",Agent Machine,MSN00008,Christine Peters,Could former model.,1,,1,1,1,1,1,1,1,1
9,CMP0009,Vanessa Gonzalez,"5982 Lee Shoals, Jessicaville, PR 81881",Parent Machine,MSN00009,Dennis Owens,Black election mention suffer.,1,,1,1,1,1,1,1,1,1
10,CMP0010,Adrienne Proctor,"60275 Alan Rest Apt. 387, Lake Louis, KY 85168",Outside Machine,MSN00010,Jennifer Price,Art really option new he.,1,,1,1,1,1,1,1,1,1
11,CMP0011,Nicole Young,"Unit 8802 Box 5207, DPO AP 88644",Teach Machine,MSN00011,Roberta Wright,Result plan trouble control.,1,,1,1,1,1,1,1,1,1
12,CMP0012,Gregory Gardner,"00197 Amber Mall, Bellmouth, WV 00980",Whatever Machine,MSN00012,Jonathan Brown,Data turn happen available.,1,,1,1,1,1,1,1,1,1
13,CMP0013,Eric Graves,"02335 Trujillo Trail Apt. 211, Lake Kristyside, RI 31339",Late Machine,MSN00013,Deborah Bennett,Bag those single serious nothing attention despite.,1,,1,1,1,1,1,1,1,1
14,CMP0014,Kevin Ball,"94758 Veronica Key Suite 408, West Terri, KY 04532",Glass Machine,MSN00014,Tina Parker,Opportunity write drive fine.,1,,1,1,1,1,1,1,1,1
15,CMP0015,Michael Morris,"358 Raymond Road Suite 875, North Carlaborough, NM 55984",Might Machine,MSN00015,Gregory Green,Short interview light important model who create.,1,,1,1,1,1,1,1,1,1
16,CMP0016,Hunter Meyer,"28717 Duffy Mountain Suite 903, Frederickstad, CT 13238",President Machine,MSN00016,Dennis Choi,Alone pull end almost court of.,1,,1,1,1,1,1,1,1,1
17,CMP0017,Charlotte Mccarty,"6967 Roy Ville Apt. 302, New Leahfort, OH 04448",Low Machine,MSN00017,Steven Massey,Huge suggest way.,1,,1,1,1,1,1,1,1,1
18,CMP0018,Robert Garcia,"63619 Thomas Islands, Port Mathew, NC 96065",Far Machine,MSN00018,Thomas Alvarado,Drive at center.,1,,1,1,1,1,1,1,1,1
19,CMP0019,Michael Williams,"5893 Nicole Village Suite 682, Chambersville, NV 58433",Deal Machine,MSN00019,Kathleen Pena,Sit sometimes hotel firm amount must almost.,1,,1,1,1,1,1,1,1,1
20,CMP0020,Eric Mcbride,"1780 Hicks Tunnel, Barrettmouth, AZ 42033",Cut Machine,MSN00020,Aaron Hamilton,Understand speech course choice social appear three.,1,,1,1,1,1,1,1,1,1
21,CMP0021,Steven Castillo,"PSC 7449, Box 5216, APO AE 24136",Western Machine,MSN00021,Brooke Reyes,Set then per event.,1,,1,1,1,1,1,1,1,1
22,CMP0022,Kathryn Evans DDS,"6829 Robin Forge Suite 878, Silvaberg, MS 67611",Wonder Machine,MSN00022,Stephen King,Structure left wife hear difficult artist special themselves.,1,,1,1,1,1,1,1,1,1
23,CMP0023,Robert Hardy,"Unit 4425 Box 8482, DPO AP 02489",Program Machine,MSN00023,Daisy Gonzalez,Chair laugh part pass drive.,1,,1,1,1,1,1,1,1,1
24,CMP0024,Amanda Edwards,"6139 Ricardo Burg, Stephaniehaven, AK 84126",Issue Machine,MSN00024,Jared Mathews,Less skin available pass.,1,,1,1,1,1,1,1,1,1
25,CMP0025,Joshua Harris,"634 Jack Square Suite 130, Lake Debbie, WY 13103",Between Machine,MSN00025,Mark Young,Gas analysis image state seek politics environment.,1,,1,1,1,1,1,1,1,1
26,CMP0026,Robert Fernandez,"5493 Marcus Village Apt. 927, Perezton, NY 68208",Parent Machine,MSN00026,Henry Adams,Boy agreement main company view travel.,1,,1,1,1,1,1,1,1,1
27,CMP0027,Jeffery Larsen,"215 Christine Fall, North Vincentville, NY 18450",Positive Machine,MSN00027,Seth Daniels,Former time likely red foreign image decade.,1,,1,1,1,1,1,1,1,1
28,CMP0028,Ryan Johnson,"6768 Barnes Throughway Apt. 828, Lake Jeffreyfurt, AK 38637",Media Machine,MSN00028,Raymond Porter,Yard share painting hotel near part apply.,1,,1,1,1,1,1,1,1,1
29,CMP0029,Ashley Allen,"USCGC Orozco, FPO AP 80976",Former Machine,MSN00029,Joseph Walton,Girl its often woman.,1,,1,1,1,1,1,1,1,1
30,CMP0030,Barbara Wilson,"2649 Anderson Views Apt. 516, South Cindy, ME 48537",As Machine,MSN00030,Nicole Harris,Staff believe use floor recently.,1,,1,1,1,1,1,1,1,1
31,CMP0031,Jennifer Kim,"8052 Heather View, West Mary, SC 26576",Claim Machine,MSN00031,Brittany Nguyen,Leg food policy charge.,1,,1,1,1,1,1,1,1,1
32,CMP0032,Scott Jones,"197 Matthew Wells Apt. 323, New Michael, CO 28215",Role Machine,MSN00032,James Davis,Part fill four society none.,1,,1,1,1,1,1,1,1,1
33,CMP0033,Robert Vasquez,"0127 Sharon Shoals Suite 040, Michellemouth, RI 65004",Anyone Machine,MSN00033,Ashley Fuentes,Listen know bad evidence involve sea.,1,,1,1,1,1,1,1,1,1
34,CMP0034,Christopher Morgan,"977 Rachel Trace, Justinside, KS 42492",Ready Machine,MSN00034,Vanessa Burton,Bit blood yet well also.,1,,1,1,1,1,1,1,1,1
35,CMP0035,Mary Ward,"Unit 6303 Box 3560, DPO AP 94675",Moment Machine,MSN00035,Brian Russell,Whether resource less over sing walk today factor.,1,,1,1,1,1,1,1,1,1
36,CMP0036,Denise Cook,"009 Melissa Crest Apt. 202, Johnbury, IL 73800",Memory Machine,MSN00036,Joanna Thompson,Style heart then hair.,1,,1,1,1,1,1,1,1,1
37,CMP0037,Christopher Smith,"454 Hill Coves, Shawnstad, WV 40956",Bad Machine,MSN00037,Justin Gates,Draw every water nation camera seek institution.,1,,1,1,1,1,1,1,1,1
38,CMP0038,Amanda Barnett,"PSC 4697, Box 1615, APO AE 23214",Too Machine,MSN00038,Robert Garcia,View message necessary recent movie.,1,,1,1,1,1,1,1,1,1
39,CMP0039,Robert Torres,"1017 Joseph Corner, Wrightville, WV 07915",Give Machine,MSN00039,Kimberly Rodriguez,Especially bag within begin late establish.,1,,1,1,1,1,1,1,1,1
40,CMP0040,Richard Miller,"28319 Robert Plaza Suite 739, New Josephtown, ME 85032",Also Machine,MSN00040,Joseph Solis,Best down never ask.,1,,1,1,1,1,1,1,1,1
41,CMP0041,Jeanne Lutz,"699 Phillips Groves Apt. 881, East Charlesstad, PW 67919",West Machine,MSN00041,Lee Thornton,Hope place you table city.,1,,1,1,1,1,1,1,1,1
42,CMP0042,Lindsay Alexander,"984 Campos Lights Apt. 839, Santiagofort, PR 56754",Woman Machine,MSN00042,Cameron Moss,Get about individual reality.,1,,1,1,1,1,1,1,1,1
43,CMP0043,Alexander Henry,"41140 Wood Oval, East Alexis, MD 92109",National Machine,MSN00043,Todd Simpson,Reality they offer already region argue.,1,,1,1,1,1,1,1,1,1
44,CMP0044,Kenneth Murphy,"9027 Monroe Inlet, Haneyberg, CA 40153",Hundred Machine,MSN00044,Kathleen Reid,Gun resource eat well may out.,1,,1,1,1,1,1,1,1,1
45,CMP0045,John Allen,"377 Eric Spur Suite 095, Brianburgh, LA 23512",None Machine,MSN00045,Brittany Morales,Establish opportunity inside middle get artist several.,1,,1,1,1,1,1,1,1,1
46,CMP0046,Katherine Brooks,"10797 Caitlyn Turnpike Suite 070, Lake Melissa, MH 88659",Friend Machine,MSN00046,Miss Kimberly Mcconnell PhD,Country near although article father after.,1,,1,1,1,1,1,1,1,1
47,CMP0047,Sara Campos,"24969 Nicholas Island, Griffithville, OK 05107",Town Machine,MSN00047,Christopher Sharp,Improve garden size.,1,,1,1,1,1,1,1,1,1
48,CMP0048,Tommy Vance,"425 Walters Grove, Jenniferland, AZ 31722",Term Machine,MSN00048,Keith Suarez,Mention might production present never.,1,,1,1,1,1,1,1,1,1
49,CMP0049,Matthew Young,"64815 Harris Stream Apt. 733, Oliviahaven, MS 50333",Long Machine,MSN00049,Jared Russo,Family candidate certainly gun store identify.,1,,1,1,1,1,1,1,1,1
50,CMP0050,Sara Pierce,"3459 Austin Crossroad, Aprilhaven, VI 94654",Read Machine,MSN00050,Mark Dickerson DDS,Read Mrs under suffer.,1,,1,1,1,1,1,1,1,1
51,CMP0051,Ariel Webb,"511 Holden Union Apt. 202, South Madison, AS 84920",Or Machine,MSN00051,Cathy Martinez,Left language decision care.,1,,1,1,1,1,1,1,1,1
52,CMP0052,Anthony Potter,"81559 Adams Park, Lake Robert, MD 04276",Difference Machine,MSN00052,Jason Watson,Within production practice lot dog.,1,,1,1,1,1,1,1,1,1
53,CMP0053,Jennifer Barnett,"USCGC Ingram, FPO AP 16397",End Machine,MSN00053,Kevin Wood,Degree use hour peace participant.,1,,1,1,1,1,1,1,1,1
54,CMP0054,Sheila Campbell,"5627 Bates Loaf, Suzanneville, TN 87840",So Machine,MSN00054,Lisa Charles,Friend yeah until some page.,1,,1,1,1,1,1,1,1,1
55,CMP0055,Paige Alvarez,"9528 Kevin Rapids Suite 128, Noblemouth, GA 20992",Write Machine,MSN00055,Donna Martin,Decide have alone source me.,1,,1,1,1,1,1,1,1,1
56,CMP0056,Stacy Carter,"21842 Shawn Spur Suite 367, East Patricia, MN 59086",Themselves Machine,MSN00056,Greg Oconnor,Those office specific article community.,1,,1,1,1,1,1,1,1,1
57,CMP0057,Kevin Cox,"Unit 6092 Box 2888, DPO AA 37338",Plant Machine,MSN00057,Robert Stanley,Discussion understand behavior himself position college.,1,,1,1,1,1,1,1,1,1
58,CMP0058,Kimberly Lee,"60003 Heidi Extension, Jacksonborough, ND 45407",You Machine,MSN00058,Michael Johnson,Left thing defense rate city fish seven change.,1,,1,1,1,1,1,1,1,1
59,CMP0059,Nicole Stanley,"598 Alicia Flat, Garychester, HI 56084",Foreign Machine,MSN00059,Joseph Anderson,Similar eye already people Congress order.,1,,1,1,1,1,1,1,1,1
60,CMP0060,Perry Dennis,"2420 Samantha Inlet Apt. 140, North Miguel, FL 51874",Natural Machine,MSN00060,John Lee,Song body man enter program such sound hold.,1,,1,1,1,1,1,1,1,1
61,CMP0061,Christopher Taylor,"51926 Robles Flats, Wallaceville, VI 49606",Charge Machine,MSN00061,Tammy Mills,Ready improve do career ask account.,1,,1,1,1,1,1,1,1,1
62,CMP0062,Ann Davis,"023 Aaron Plaza Apt. 688, Daleland, GA 06471",House Machine,MSN00062,David Davis,Attorney send could number notice trial coach.,1,,1,1,1,1,1,1,1,1
63,CMP0063,Glenda Wolf,"282 Teresa Glens, New Crystalstad, MI 65459",Factor Machine,MSN00063,Anthony Hill,Beat without safe view meet the.,1,,1,1,1,1,1,1,1,1
64,CMP0064,Natalie Bell,"334 Monique Crescent, Lake Davidton, PA 10795",Everybody Machine,MSN00064,Tamara Bates,Because a give information theory.,1,,1,1,1,1,1,1,1,1
65,CMP0065,Michael Brady,"5990 Danielle Course, Amberview, VI 10022",Bag Machine,MSN00065,Ricardo Boyd,Heavy miss group service set pull.,1,,1,1,1,1,1,1,1,1
66,CMP0066,Joseph Daniel,"8642 Erin Fields, South Kellymouth, AR 61883",Matter Machine,MSN00066,Vanessa Clark,Though responsibility important building.,1,,1,1,1,1,1,1,1,1
67,CMP0067,Scott Gibson,"38992 James Inlet Suite 686, New Emily, MH 58036",Half Machine,MSN00067,Jamie Turner,Media talk medical physical.,1,,1,1,1,1,1,1,1,1
68,CMP0068,Courtney Little,"8526 Andrew Unions, Sloanchester, WI 59358",Law Machine,MSN00068,Hunter Johnson,Six health actually by.,1,,1,1,1,1,1,1,1,1
69,CMP0069,Wesley Huff,"PSC 1509, Box 7495, APO AP 37985",Brother Machine,MSN00069,Tiffany Elliott,Minute write business table.,1,,1,1,1,1,1,1,1,1
70,CMP0070,Sarah Smith,"USNS Robertson, FPO AP 72779",Although Machine,MSN00070,Katrina Smith,Role identify town more.,1,,1,1,1,1,1,1,1,1
71,CMP0071,Brooke Goodwin,"55137 Amanda Light, Christopherhaven, HI 94945",Attack Machine,MSN00071,Eric Rodriguez,Manager information security direction how three.,1,,1,1,1,1,1,1,1,1
72,CMP0072,Mitchell Rios,"3945 Anderson Spurs Suite 646, East Michael, CA 27368",Type Machine,MSN00072,John Chan,Single trip college the world different.,1,,1,1,1,1,1,1,1,1
73,CMP0073,Cole Norris,"45901 Thomas Parks Apt. 869, Lake Jacqueline, VT 07928",Huge Machine,MSN00073,Emily Ramos,Standard not billion interest color military buy.,1,,1,1,1,1,1,1,1,1
74,CMP0074,Brenda Gray,"85619 Anderson Turnpike Suite 417, Warrenburgh, MN 90771",Name Machine,MSN00074,Ryan Coleman,Edge seat quality end artist science must.,1,,1,1,1,1,1,1,1,1
75,CMP0075,Lawrence Chan,"286 Logan Brooks Suite 005, Port Scottfurt, MT 84107",Around Machine,MSN00075,Richard Rios,Yeah cut activity idea form.,1,,1,1,1,1,1,1,1,1
76,CMP0076,Erik Goodwin,"PSC 6636, Box 3239, APO AE 69952",Other Machine,MSN00076,Ryan Harrell,Finish exist federal field single drug.,1,,1,1,1,1,1,1,1,1
77,CMP0077,James Arroyo,"6409 Nicholas Common Suite 168, Patriciaborough, PW 92892",Mission Machine,MSN00077,Lisa Cruz,Gun policy defense have.,1,,1,1,1,1,1,1,1,1
78,CMP0078,Ashley Molina,"81953 Parker Pines, West Christopherberg, UT 36391",Question Machine,MSN00078,Melissa Murray,Enjoy often investment letter.,1,,1,1,1,1,1,1,1,1
79,CMP0079,Robyn Kennedy,"73749 Hannah Roads, West Alexbury, DE 40169",Policy Machine,MSN00079,Robert Nelson,View relate soldier.,1,,1,1,1,1,1,1,1,1
80,CMP0080,Mr. Justin Houston,"66463 Aguirre River, Lake Michelle, TN 17959",Arm Machine,MSN00080,Seth Parsons,Position foreign especially.,1,,1,1,1,1,1,1,1,1
81,CMP0081,Sharon Villegas,"Unit 9297 Box 3092, DPO AE 36105",Mother Machine,MSN00081,Gary James,Never enjoy collection almost away.,1,,1,1,1,1,1,1,1,1
82,CMP0082,Richard Lara,"797 Nathaniel Crossing, East Kimberly, AR 98581",Really Machine,MSN00082,Steven Bailey,Congress strategy pattern.,1,,1,1,1,1,1,1,1,1
83,CMP0083,Jennifer Edwards,"644 Williams Motorway, Kellytown, MT 78026",Interview Machine,MSN00083,Ricky Mcdonald,Others job on authority.,1,,1,1,1,1,1,1,1,1
84,CMP0084,Edward Smith,"27931 Burke Inlet, East Arthurhaven, NJ 16949",Evidence Machine,MSN00084,Scott Wagner,Speak write shoulder source operation push.,1,,1,1,1,1,1,1,1,1
85,CMP0085,Dominique Gutierrez,"1676 Mark Hollow Suite 298, Danielleside, GA 97019",Able Machine,MSN00085,Cheyenne Ortiz,Sell table tend.,1,,1,1,1,1,1,1,1,1
86,CMP0086,Paige Wood,"29131 Anthony Views Apt. 143, Warrenport, WY 99241",Environmental Machine,MSN00086,Brian Clark,Fear view few six hair fire institution network.,1,,1,1,1,1,1,1,1,1
87,CMP0087,Lisa Stewart,"7182 Michelle Parkway, Lake Keithview, AZ 86189",Money Machine,MSN00087,Caitlin Webb,Team school hour action concern hundred environmental.,1,,1,1,1,1,1,1,1,1
88,CMP0088,Caroline Adkins,"PSC 6513, Box 9089, APO AP 08511",Quality Machine,MSN00088,Diane Lawrence,Series might another where look.,1,,1,1,1,1,1,1,1,1
89,CMP0089,Jack Smith,"15375 Emily Mission Suite 906, South Charles, PW 13860",Administration Machine,MSN00089,John Ward,Lawyer significant reduce policy seem.,1,,1,1,1,1,1,1,1,1
90,CMP0090,Tom Dunn,"05577 Snyder Center, Lewisborough, TN 08024",Design Machine,MSN00090,Joshua Clay,Low since bed site various.,1,,1,1,1,1,1,1,1,1
91,CMP0091,Janet Kirk,"76532 Carla Wall Suite 769, Thomasshire, SD 55541",Year Machine,MSN00091,Anita Villa,Which behavior popular generation adult.,1,,1,1,1,1,1,1,1,1
92,CMP0092,Daniel Herrera,"8737 Amanda Extension, Lake Danielle, PW 66271",Fire Machine,MSN00092,Joseph Evans,Close thousand over quite before letter to.,1,,1,1,1,1,1,1,1,1
93,CMP0093,Dana Moore,"9373 Dorsey Parks, Ericstad, KY 93309",Receive Machine,MSN00093,Lisa Harris,Offer night question around remain investment.,1,,1,1,1,1,1,1,1,1
94,CMP0094,Jessica Graves,"35417 Taylor Tunnel Apt. 414, East Erin, FL 16840",Friend Machine,MSN00094,Michelle Hernandez,However newspaper support make floor until those.,1,,1,1,1,1,1,1,1,1
95,CMP0095,Jessica Jackson,"46533 Coleman Squares, Martinezmouth, IN 71928",Better Machine,MSN00095,Andrew Evans,Poor walk technology language rest discussion player.,1,,1,1,1,1,1,1,1,1
96,CMP0096,Gregory Jones,"PSC 2817, Box 9147, APO AE 16516",Enough Machine,MSN00096,Jonathan Hernandez,Population home company fact health.,1,,1,1,1,1,1,1,1,1
97,CMP0097,James Gordon,"7175 Herrera Inlet Apt. 663, New Christopherstad, MS 23809",Number Machine,MSN00097,Maria Hall,News from law among.,1,,1,1,1,1,1,1,1,1
98,CMP0098,Tonya Perry,"USCGC Garcia, FPO AP 58593",Act Machine,MSN00098,Deborah Allen,Focus its enough occur area.,1,,1,1,1,1,1,1,1,1
99,CMP0099,Andrew Clark,"9896 Jay Loop, New Julie, HI 35460",Beyond Machine,MSN00099,Jeremy Lee,Ten data water take senior.,1,,1,1,1,1,1,1,1,1
100,CMP0100,Thomas Frye,"USCGC Wong, FPO AE 16156",But Machine,MSN00100,Rachel Cooper,Cut those future back.,1,,1,1,1,1,1,1,1,1
